{
  "schemaVersion": "1.0.0",
  "evidenceId": "ev:example:META-001:0001",
  "testId": "META-001",
  "requirementIds": ["GOV-001", "GOV-002", "GOV-003", "GOV-004", "GOV-005", "ACT-002", "AI-001"],
  "status": "passed",
  "candidate": {
    "repository": "https://github.com/example/platform-core",
    "commitSha": "0123456789abcdef0123456789abcdef01234567",
    "dirty": false
  },
  "runner": {
    "name": "platform-conformance",
    "version": "1.0.0",
    "imageDigest": "sha256:aaaaaaaaaaaaaaaaaaaaaaaaaaaaaaaaaaaaaaaaaaaaaaaaaaaaaaaaaaaaaaaa",
    "testSourceDigest": "sha256:bbbbbbbbbbbbbbbbbbbbbbbbbbbbbbbbbbbbbbbbbbbbbbbbbbbbbbbbbbbbbbbb"
  },
  "environment": {
    "profile": "planner-package",
    "configDigest": "sha256:cccccccccccccccccccccccccccccccccccccccccccccccccccccccccccccccc",
    "region": "local",
    "hardware": "not-performance-sensitive",
    "seed": 1
  },
  "startedAt": "2026-08-22T12:00:00.000Z",
  "finishedAt": "2026-08-22T12:00:01.000Z",
  "exitCode": 0,
  "measurements": { "requirements": 117, "tests": 43, "errors": 0 },
  "artifacts": [
    { "name": "meta-validation.json", "sha256": "dddddddddddddddddddddddddddddddddddddddddddddddddddddddddddddddd" }
  ],
  "provenance": {
    "ciRunId": "example-run-1",
    "workflowIdentity": "https://github.com/example/platform-conformance/.github/workflows/meta.yml@refs/heads/main",
    "attestationRef": "oci://registry.example/platform-conformance@sha256:eeeeeeeeeeeeeeeeeeeeeeeeeeeeeeeeeeeeeeeeeeeeeeeeeeeeeeeeeeeeeeee"
  }
}
